{
    "$schema": "https://json-schema.org/draft/2020-12/schema",
    "title": "SKOS Concept",
    "description": "JSON Schema for a SKOS Concept in JSON-LD form. A unit of thought within a concept scheme. Supports labels (prefLabel, altLabel, hiddenLabel), notations, hierarchical relations (broader/narrower), associative relations (related), cross-scheme mapping properties, scheme membership, and documentary notes. Based on the W3C SKOS Reference (https://www.w3.org/TR/skos-reference/).",
    "type": "object",
    "properties": {
        "@context": {
            "description": "JSON-LD context declaring the skos namespace prefix. May be a single object or an array of strings and objects.",
            "anyOf": [
                {
                    "type": "object",
                    "properties": {
                        "skos": {
                            "const": "http://www.w3.org/2004/02/skos/core#"
                        }
                    },
                    "required": [
                        "skos"
                    ]
                },
                {
                    "type": "array",
                    "items": {
                        "anyOf": [
                            {
                                "type": "string"
                            },
                            {
                                "type": "object"
                            }
                        ]
                    },
                    "contains": {
                        "type": "object",
                        "properties": {
                            "skos": {
                                "const": "http://www.w3.org/2004/02/skos/core#"
                            }
                        },
                        "required": [
                            "skos"
                        ]
                    }
                }
            ]
        },
        "@id": {
            "type": "string",
            "description": "URI identifier for this concept."
        },
        "@type": {
            "type": "array",
            "items": {
                "type": "string"
            },
            "contains": {
                "const": "skos:Concept"
            },
            "minItems": 1
        },
        "skos:prefLabel": {
            "description": "Preferred lexical label for this concept. A single string, a single language-tagged value, or an array of language-tagged values. Each language should appear at most once.",
            "anyOf": [
                {
                    "type": "string"
                },
                {
                    "$ref": "#/$defs/LanguageTaggedValue"
                },
                {
                    "type": "array",
                    "items": {
                        "$ref": "#/$defs/LanguageTaggedValue"
                    }
                }
            ]
        },
        "skos:altLabel": {
            "description": "Alternative lexical labels (acronyms, abbreviations, variants).",
            "anyOf": [
                {
                    "type": "string"
                },
                {
                    "$ref": "#/$defs/LanguageTaggedValue"
                },
                {
                    "type": "array",
                    "items": {
                        "anyOf": [
                            {
                                "type": "string"
                            },
                            {
                                "$ref": "#/$defs/LanguageTaggedValue"
                            }
                        ]
                    }
                }
            ]
        },
        "skos:hiddenLabel": {
            "description": "Labels accessible to free-text search but not displayed.",
            "anyOf": [
                {
                    "type": "string"
                },
                {
                    "$ref": "#/$defs/LanguageTaggedValue"
                },
                {
                    "type": "array",
                    "items": {
                        "anyOf": [
                            {
                                "type": "string"
                            },
                            {
                                "$ref": "#/$defs/LanguageTaggedValue"
                            }
                        ]
                    }
                }
            ]
        },
        "skos:notation": {
            "description": "Classification code for this concept within a scheme.",
            "anyOf": [
                {
                    "type": "string"
                },
                {
                    "type": "array",
                    "items": {
                        "type": "string"
                    }
                }
            ]
        },
        "skos:definition": {
            "description": "Formal explanation of the meaning of this concept.",
            "anyOf": [
                {
                    "type": "string"
                },
                {
                    "$ref": "#/$defs/LanguageTaggedValue"
                },
                {
                    "type": "array",
                    "items": {
                        "anyOf": [
                            {
                                "type": "string"
                            },
                            {
                                "$ref": "#/$defs/LanguageTaggedValue"
                            }
                        ]
                    }
                }
            ]
        },
        "skos:scopeNote": {
            "description": "Note clarifying meaning and/or intended use.",
            "anyOf": [
                {
                    "type": "string"
                },
                {
                    "$ref": "#/$defs/LanguageTaggedValue"
                },
                {
                    "type": "array",
                    "items": {
                        "anyOf": [
                            {
                                "type": "string"
                            },
                            {
                                "$ref": "#/$defs/LanguageTaggedValue"
                            }
                        ]
                    }
                }
            ]
        },
        "skos:note": {
            "description": "General note about this concept.",
            "anyOf": [
                {
                    "type": "string"
                },
                {
                    "$ref": "#/$defs/LanguageTaggedValue"
                },
                {
                    "type": "array",
                    "items": {
                        "anyOf": [
                            {
                                "type": "string"
                            },
                            {
                                "$ref": "#/$defs/LanguageTaggedValue"
                            }
                        ]
                    }
                }
            ]
        },
        "skos:historyNote": {
            "description": "Note about past state or use.",
            "anyOf": [
                {
                    "type": "string"
                },
                {
                    "$ref": "#/$defs/LanguageTaggedValue"
                },
                {
                    "type": "array",
                    "items": {
                        "anyOf": [
                            {
                                "type": "string"
                            },
                            {
                                "$ref": "#/$defs/LanguageTaggedValue"
                            }
                        ]
                    }
                }
            ]
        },
        "skos:changeNote": {
            "description": "Note documenting a change.",
            "anyOf": [
                {
                    "type": "string"
                },
                {
                    "$ref": "#/$defs/LanguageTaggedValue"
                },
                {
                    "type": "array",
                    "items": {
                        "anyOf": [
                            {
                                "type": "string"
                            },
                            {
                                "$ref": "#/$defs/LanguageTaggedValue"
                            }
                        ]
                    }
                }
            ]
        },
        "skos:editorialNote": {
            "description": "Note for editors and maintainers.",
            "anyOf": [
                {
                    "type": "string"
                },
                {
                    "$ref": "#/$defs/LanguageTaggedValue"
                },
                {
                    "type": "array",
                    "items": {
                        "anyOf": [
                            {
                                "type": "string"
                            },
                            {
                                "$ref": "#/$defs/LanguageTaggedValue"
                            }
                        ]
                    }
                }
            ]
        },
        "skos:example": {
            "description": "Example of use of this concept.",
            "anyOf": [
                {
                    "type": "string"
                },
                {
                    "$ref": "#/$defs/LanguageTaggedValue"
                },
                {
                    "type": "array",
                    "items": {
                        "anyOf": [
                            {
                                "type": "string"
                            },
                            {
                                "$ref": "#/$defs/LanguageTaggedValue"
                            }
                        ]
                    }
                }
            ]
        },
        "skos:inScheme": {
            "description": "Concept scheme(s) this concept belongs to.",
            "anyOf": [
                {
                    "type": "object",
                    "properties": {
                        "@id": {
                            "type": "string"
                        }
                    },
                    "required": [
                        "@id"
                    ]
                },
                {
                    "type": "array",
                    "items": {
                        "type": "object",
                        "properties": {
                            "@id": {
                                "type": "string"
                            }
                        },
                        "required": [
                            "@id"
                        ]
                    }
                }
            ]
        },
        "skos:topConceptOf": {
            "description": "Concept scheme(s) for which this is a top concept.",
            "anyOf": [
                {
                    "type": "object",
                    "properties": {
                        "@id": {
                            "type": "string"
                        }
                    },
                    "required": [
                        "@id"
                    ]
                },
                {
                    "type": "array",
                    "items": {
                        "type": "object",
                        "properties": {
                            "@id": {
                                "type": "string"
                            }
                        },
                        "required": [
                            "@id"
                        ]
                    }
                }
            ]
        },
        "skos:broader": {
            "description": "Broader (parent) concepts in the hierarchy. Items are inline concept objects or @id references.",
            "type": "array",
            "items": {
                "anyOf": [
                    {
                        "$ref": "#/$defs/ConceptRef"
                    },
                    {
                        "$ref": "#"
                    }
                ]
            }
        },
        "skos:narrower": {
            "description": "Narrower (child) concepts in the hierarchy. Items are inline concept objects or @id references.",
            "type": "array",
            "items": {
                "anyOf": [
                    {
                        "$ref": "#/$defs/ConceptRef"
                    },
                    {
                        "$ref": "#"
                    }
                ]
            }
        },
        "skos:related": {
            "description": "Associatively related concepts.",
            "type": "array",
            "items": {
                "anyOf": [
                    {
                        "$ref": "#/$defs/ConceptRef"
                    },
                    {
                        "$ref": "#"
                    }
                ]
            }
        },
        "skos:exactMatch": {
            "description": "Concepts in other schemes with equivalent meaning.",
            "type": "array",
            "items": {
                "$ref": "#/$defs/ConceptRef"
            }
        },
        "skos:closeMatch": {
            "description": "Concepts in other schemes with similar meaning.",
            "type": "array",
            "items": {
                "$ref": "#/$defs/ConceptRef"
            }
        },
        "skos:broadMatch": {
            "description": "Broader concepts in other schemes.",
            "type": "array",
            "items": {
                "$ref": "#/$defs/ConceptRef"
            }
        },
        "skos:narrowMatch": {
            "description": "Narrower concepts in other schemes.",
            "type": "array",
            "items": {
                "$ref": "#/$defs/ConceptRef"
            }
        },
        "skos:relatedMatch": {
            "description": "Related concepts in other schemes.",
            "type": "array",
            "items": {
                "$ref": "#/$defs/ConceptRef"
            }
        }
    },
    "required": [
        "@type",
        "skos:prefLabel"
    ],
    "$defs": {
        "ConceptRef": {
            "type": "object",
            "description": "A reference to a SKOS Concept by URI.",
            "properties": {
                "@id": {
                    "type": "string",
                    "description": "URI of the referenced concept."
                }
            },
            "required": [
                "@id"
            ]
        },
        "LanguageTaggedValue": {
            "type": "object",
            "description": "An RDF literal value with a language tag, serialized as a JSON-LD value object.",
            "properties": {
                "@value": {
                    "type": "string",
                    "description": "The text content."
                },
                "@language": {
                    "type": "string",
                    "description": "BCP 47 language tag (e.g. en, fr, de)."
                }
            },
            "required": [
                "@value",
                "@language"
            ]
        }
    }
}
